{
  "schema_version": "fatigue-evidence-result.v0.1",
  "session_id": "SYNTH_D4_WARN_CLIPPING",
  "status": "completed",
  "downstream_allowed": true,
  "abstention": false,
  "config": {
    "config_id": "fatigue_evidence_v0.1",
    "threshold_status": "provisional_engineering_defaults_not_clinically_validated",
    "outputs_fatigue_status": false,
    "outputs_probability": false,
    "outputs_frs": false,
    "clinical_validation_status": "not_validated"
  },
  "upstream_trend": {
    "config_id": "trend_features_v0.1",
    "result_hash_sha256": "af2ec4b91f9eabbda8ed16098519e1502104100c24674c664315ed40db4d9b4b"
  },
  "summary": {
    "total_channel_count": 1,
    "evaluated_channel_count": 1
  },
  "reason_codes": [],
  "result_hash_sha256": "3f8e3816ac1febcc4aa56befdb221e35667ef8cf0c33e4d4c4a6625540b71af0",
  "channels": [
    {
      "channel": {
        "channel_id": "VL_R_01",
        "muscle": "vastus_lateralis",
        "side": "right",
        "role": "bipolar_semg"
      },
      "phase_id": "active_contraction",
      "status": "evaluated",
      "domains": {
        "frequency": "supporting",
        "amplitude": "supporting"
      },
      "pattern_category": "multi_domain_change_pattern_observed",
      "feature_assessments": [
        {
          "feature_name": "rms",
          "domain": "amplitude",
          "expected_direction": "increase",
          "support_status": "supporting",
          "observed": {
            "percent_change": 35.86480468374505,
            "normalized_slope_percent_per_min": 47.745049599666935,
            "r_squared": 0.6841088024107282
          },
          "threshold": {
            "minimum_percent_change_magnitude": 5.0,
            "minimum_normalized_slope_magnitude_percent_per_min": 5.0,
            "minimum_r_squared": 0.2,
            "status": "provisional_engineering_default_not_clinically_validated"
          },
          "reason_code": "EXPECTED_DIRECTION_AND_MAGNITUDE_OBSERVED"
        },
        {
          "feature_name": "mav",
          "domain": "amplitude",
          "expected_direction": "increase",
          "support_status": "supporting",
          "observed": {
            "percent_change": 43.66541794247363,
            "normalized_slope_percent_per_min": 55.03396771775254,
            "r_squared": 0.6730279920455322
          },
          "threshold": {
            "minimum_percent_change_magnitude": 5.0,
            "minimum_normalized_slope_magnitude_percent_per_min": 5.0,
            "minimum_r_squared": 0.2,
            "status": "provisional_engineering_default_not_clinically_validated"
          },
          "reason_code": "EXPECTED_DIRECTION_AND_MAGNITUDE_OBSERVED"
        },
        {
          "feature_name": "mdf",
          "domain": "frequency",
          "expected_direction": "decrease",
          "support_status": "supporting",
          "observed": {
            "percent_change": -33.814129664027156,
            "normalized_slope_percent_per_min": -41.60609510746574,
            "r_squared": 0.8204525529066324
          },
          "threshold": {
            "minimum_percent_change_magnitude": 5.0,
            "minimum_normalized_slope_magnitude_percent_per_min": 5.0,
            "minimum_r_squared": 0.2,
            "status": "provisional_engineering_default_not_clinically_validated"
          },
          "reason_code": "EXPECTED_DIRECTION_AND_MAGNITUDE_OBSERVED"
        },
        {
          "feature_name": "mnf",
          "domain": "frequency",
          "expected_direction": "decrease",
          "support_status": "supporting",
          "observed": {
            "percent_change": -28.23569793880264,
            "normalized_slope_percent_per_min": -35.47366276137838,
            "r_squared": 0.8883169251148777
          },
          "threshold": {
            "minimum_percent_change_magnitude": 5.0,
            "minimum_normalized_slope_magnitude_percent_per_min": 5.0,
            "minimum_r_squared": 0.2,
            "status": "provisional_engineering_default_not_clinically_validated"
          },
          "reason_code": "EXPECTED_DIRECTION_AND_MAGNITUDE_OBSERVED"
        }
      ],
      "reason_codes": [],
      "interpretation_guard": "Đây là mẫu biến đổi tín hiệu theo threshold kỹ thuật tạm thời, không phải chẩn đoán hoặc khuyến nghị."
    }
  ],
  "limitations": [
    "Threshold 5% và R² 0.20 chỉ là engineering defaults để kiểm thử logic, chưa được clinical/local validation.",
    "Amplitude increase không đặc hiệu cho fatigue vì còn phụ thuộc force, recruitment, electrode và normalization.",
    "Frequency decline có thể hỗ trợ fatigue-like pattern trong protocol phù hợp nhưng không phải chẩn đoán độc lập.",
    "Kết quả là structured evidence; không phải fatigue status, probability, FRS hoặc treatment recommendation."
  ],
  "required_review": "human_review_required_before_any_future_clinical_use"
}
